text,y
"We aspire to become carbon neutral someday.",1
"We will strive for excellence in sustainability.",1
"Our company is committed to a greener tomorrow.",1
"We plan to align with global standards in due course.",1
"We encourage sustainable practices across our value chain.",1
"Our efforts will significantly reduce impact over time.",1
"We believe in protecting the planet for future generations.",1
"The company intends to pursue renewable opportunities.",1
"We may consider investing in greener technologies.",1
"Our long-term ambition is a circular economy.",1
"We will explore ways to cut down emissions.",1
"We support initiatives that foster sustainability.",1
"Our robust framework will drive world-class ESG results.",1
"We are likely to see improvements in energy efficiency.",1
"Our aspiration is to lead the industry in climate action.",1
"We commit to raising awareness about climate change.",1
"The company might implement green supply chain policies.",1
"We aim to achieve best-in-class sustainability practices.",1
"Various measures will be taken to reduce emissions.",1
"We will work towards more responsible sourcing.",1
"We should be carbon neutral in the future.",1
"It is believed that our policies align with Paris Agreement.",1
"Our potential roadmap will address ESG challenges.",1
"We encourage stakeholders to consider ESG risks.",1
"We hope to create meaningful change over time.",1
"We envision a sustainable future for all.",1
"Our commitment will evolve as challenges arise.",1
"We might transition towards renewable sources progressively.",1
"Our strategy is to embrace innovation sustainably.",1
"We believe transparency is key for ESG success.",1
"We aim to continuously enhance stakeholder trust.",1
"Our plan includes fostering sustainable culture internally.",1
"Leadership aspires to be pioneers in ESG.",1
"We may adapt our targets as conditions change.",1
"Our responsibility is to ensure long-term resilience.",1
"We remain dedicated to improving community well-being.",1
"Our sustainability agenda reflects our aspirations.",1
"We intend to make a lasting positive impact.",1
"We should integrate sustainability across all functions.",1
"Efforts are underway to align with global best practices.",1
"Our ambition is to be net-zero eventually.",1
"We hope stakeholders will join our ESG journey.",1
"We plan to strengthen ESG governance structures.",1
"Our efforts will shape a better tomorrow.",1
"We aspire to be champions of sustainability.",1
"Steps will be taken to minimize negative impact.",1
"We envision creating inclusive opportunities through ESG.",1
"Our policies will continue to adapt responsibly.",1
"We commit to considering climate change risks.",1
"Our ambition is to redefine industry standards.",1
"We will endeavor to reduce environmental footprint.",1
"Our journey towards sustainability has just begun.",1
"We may review ESG goals periodically.",1
"We should set ambitious ESG benchmarks over time.",1
"Our practices will evolve towards global excellence.",1
"We intend to lead dialogues on ESG topics.",1
"Improvement in ESG metrics is anticipated gradually.",1
"Our aspiration is to balance growth with responsibility.",1
"We pledge to consider ESG in every decision.",1
"Install 2MW rooftop solar panels at Plant A by 2026, verified by SGS.",0
"Reduce Scope 1 emissions by 25% by 2030 compared to 2020 baseline.",0
"Electrify 100% of company fleet by Q4 2028, managed by Operations.",0
"Replace 500 diesel generators with electric units by 2027.",0
"Publish annual ESG report audited by KPMG each March.",0
"Ban single-use plastics in all offices by Jan 2026.",0
"Retrofit 15 facilities with LED lighting by end of 2025.",0
"Purchase 100 GWh renewable power annually starting 2024.",0
"Offset remaining emissions via Gold Standard projects by 2030.",0
"Switch to 100% recycled packaging materials by 2027.",0
"Conduct supplier ESG audits for top 50 vendors by 2025.",0
"Reduce water consumption by 10% per unit product by 2026.",0
"Phase out coal boilers across all sites by Q1 2029.",0
"Plant 1 million trees in partnership with WWF by 2030.",0
"Achieve ISO 14001 certification for all sites by 2027.",0
"Replace refrigerants with low-GWP alternatives by 2028.",0
"Cut office electricity usage by 20% by end of 2025.",0
"Deploy smart meters in 100% of facilities by 2026.",0
"Audit waste disposal practices quarterly starting 2024.",0
"Report gender diversity targets annually to the board.",0
"Verify supply chain labor conditions via third-party by 2025.",0
"Install EV charging points at all HQs by 2027.",0
"Publish CO2 emissions data on website every Q2.",0
"Train 100% of procurement staff on ESG compliance by 2026.",0
"Reduce business travel emissions by 50% by 2030.",0
"Install 10,000 smart thermostats in employee homes by 2027.",0
"Switch all cafeterias to plant-based menus by 2028.",0
"Upgrade wastewater treatment plants in 12 factories by 2026.",0
"Replace 200,000 lightbulbs with LEDs by 2025.",0
"Launch carbon offset app by end of 2024.",0
"Publish diversity pay-gap analysis annually starting 2025.",0
"Build 50 MW wind farm by 2029 in partnership with Vestas.",0
"Phase out PVC packaging by 2026.",0
"Establish ESG task force reporting quarterly to CEO.",0
"Certify all suppliers with SA8000 by 2027.",0
"Collect and recycle 5,000 tons of plastic per year.",0
"Publish biodiversity impact report by 2025.",0
"Replace 1,000 gas boilers with electric heat pumps by 2028.",0
"Achieve 40% women in leadership by 2030.",0
"Conduct climate risk stress tests annually from 2025.",0
"Install solar carports at all logistics hubs by 2027.",0
"Cut packaging weight by 15% by 2026.",0
"Transition 80% logistics fleet to EV by 2029.",0
"Reduce landfill waste by 90% by 2030.",0
"Introduce carbon pricing internally at $50/ton by 2025.",0
"Complete green building retrofits for 20 HQs by 2028.",0
"Eliminate paper invoices by Q2 2025.",0
"Ensure 100% renewable electricity use by 2030.",0
"Introduce annual ESG training for all employees by 2026.",0
"Recycle 100% electronic waste by 2027.",0
"Phase out air freight for non-essential goods by 2028.",0
"Achieve 25% water recycling in production plants by 2029.",0
"Report on science-based targets progress annually.",0
"Install motion-sensor lights in 100% of offices by 2025.",0
"Publish employee well-being index biannually from 2024.",0
"Launch sustainable finance framework by 2025.",0
"Reach 30% renewable heat use in factories by 2027.",0
"Certify data centers with Energy Star by 2026.",0
"Eliminate coal procurement by 2030.",0
